{
  "schema_version": 1,
  "catalog_digest": "sha256:e4c1a007806ae238bb4bafe96777f85b2541daa30f295edee90ba78bb1d6f39e",
  "catalog": {
    "catalog_id": "mnemosyne-apple-silicon",
    "catalog_version": "test-2026.08.1",
    "catalog_sequence": 42,
    "issued_at": 1787961600,
    "expires_at": 1819497600,
    "publisher": "mnemosyne",
    "build_revision": "bbbbbbbbbbbbbbbbbbbbbbbbbbbbbbbbbbbbbbbb",
    "logical_models": [
      {
        "logical_model_id": "example-flash-vnext",
        "display_name": "Example Flash vNext",
        "family": "example-flash",
        "kind": "generation",
        "capabilities": [
          "chat/completions",
          "messages",
          "responses"
        ],
        "declared_max_context_tokens": 32768
      }
    ],
    "artifacts": [
      {
        "artifact_id": "example-flash-vnext-gguf-q4",
        "logical_model_id": "example-flash-vnext",
        "format": "gguf",
        "quantization": "Q4_K_M",
        "source": {
          "kind": "huggingface",
          "transport": "https",
          "registry": "huggingface.co",
          "repository_id": "mnemosyne-tests/example-flash-vnext-GGUF",
          "revision": "aaaaaaaaaaaaaaaaaaaaaaaaaaaaaaaaaaaaaaaa"
        },
        "files": [
          {
            "path": "example-flash-vnext-Q4_K_M.gguf",
            "size_bytes": 1000,
            "sha256": "sha256:1111111111111111111111111111111111111111111111111111111111111111"
          }
        ],
        "manifest_digest": "sha256:2ecb9aede3da70b17df5ec09d7807a2411a25513529ab698081430c362dc7c54",
        "total_size_bytes": 1000
      }
    ],
    "recipes": [
      {
        "recipe_id": "example-flash-vnext-llamacpp-q4",
        "logical_model_id": "example-flash-vnext",
        "artifact_id": "example-flash-vnext-gguf-q4",
        "engine": "llama.cpp",
        "capabilities": [
          "chat/completions",
          "messages",
          "responses"
        ],
        "compatibility_tier": "experimental",
        "context": {
          "guaranteed_tokens": 8192,
          "native_max_tokens": 32768,
          "evidence": {
            "evidence_class": "catalog_tested",
            "evidence_id": "test-evidence-1",
            "evidence_digest": "sha256:2222222222222222222222222222222222222222222222222222222222222222",
            "observed_at": 1787961600,
            "expires_at": 1819497600
          }
        },
        "memory": {
          "weights_bytes": 1200,
          "runtime_overhead_bytes": 200,
          "activation_overhead_bytes": 300,
          "kv_bytes_per_token_per_slot": 64,
          "safety_headroom_bytes": 1024,
          "max_recommended_concurrency": 2,
          "estimate_class": "conservative",
          "evidence": {
            "evidence_class": "conservative",
            "evidence_id": "test-memory-1",
            "evidence_digest": "sha256:3333333333333333333333333333333333333333333333333333333333333333",
            "observed_at": 1787961600,
            "expires_at": 1819497600
          }
        },
        "hardware": {
          "architecture": "arm64",
          "soc_families": [
            "apple-m1",
            "apple-m2-pro"
          ],
          "minimum_gpu_cores": 8,
          "minimum_unified_memory_bytes": 17179869184,
          "minimum_macos": {
            "major": 15,
            "minor": 0
          },
          "maximum_macos_exclusive": {
            "major": 27,
            "minor": 0
          },
          "required_features": [
            "metal",
            "unified-memory"
          ]
        },
        "runtime": {
          "engine": "llama.cpp",
          "release_tier": "preview",
          "minimum_version": "b6000",
          "maximum_version_exclusive": "b9000",
          "known_bad_versions": [
            "b6123"
          ],
          "allowed_runtime_fingerprints": [],
          "known_bad_runtime_fingerprints": [
            "sha256:4444444444444444444444444444444444444444444444444444444444444444"
          ],
          "required_features": [
            "apple-metal",
            "flash-attention"
          ]
        },
        "launch": {
          "engine": "llama.cpp",
          "parallel_slots": 2,
          "gpu_offload": "all",
          "flash_attention": "automatic"
        },
        "evidence": {
          "evidence_class": "catalog_tested",
          "evidence_id": "test-evidence-1",
          "evidence_digest": "sha256:2222222222222222222222222222222222222222222222222222222222222222",
          "observed_at": 1787961600,
          "expires_at": 1819497600
        }
      }
    ]
  },
  "signatures": [
    {
      "key_id": "test-catalog-2026-a",
      "algorithm": "Ed25519",
      "signature": "5Kat9gmx4_fbqAJFLNN6BJOpZkV41zKyiqNcRYBPMlShYw-3oHna8VZEljV8udWw9VQ2Q3gyozxPaHBz4wWqDw"
    }
  ]
}
